{
  "schema_version": "v1",
  "generated_at": "2026-03-15T00:00:00Z",
  "observation_set": {
    "schema_version": "v1",
    "generated_at": "2026-03-15T00:00:00Z",
    "observations": [
      {
        "observation_id": "obs_sleep_01",
        "kind": "sleep_episode",
        "start_at": "2026-03-05T04:30:00Z",
        "end_at": "2026-03-05T12:30:00Z",
        "zone_id": "America/New_York",
        "sleep": {
          "classification": "principal"
        },
        "provenance": {
          "acquisition_method": "synthetic",
          "evidence_status": "directly_observed",
          "recorded_at": "2026-03-05T12:35:00Z",
          "source_record_id": "synthetic-sleep-01"
        }
      },
      {
        "observation_id": "obs_sleep_02",
        "kind": "sleep_episode",
        "start_at": "2026-03-06T05:20:00Z",
        "end_at": "2026-03-06T13:10:00Z",
        "zone_id": "America/New_York",
        "sleep": {
          "classification": "principal"
        },
        "provenance": {
          "acquisition_method": "synthetic",
          "evidence_status": "directly_observed",
          "recorded_at": "2026-03-06T13:15:00Z",
          "source_record_id": "synthetic-sleep-02"
        }
      },
      {
        "observation_id": "obs_sleep_03",
        "kind": "sleep_episode",
        "start_at": "2026-03-07T06:10:00Z",
        "end_at": "2026-03-07T14:20:00Z",
        "zone_id": "America/New_York",
        "sleep": {
          "classification": "principal"
        },
        "provenance": {
          "acquisition_method": "synthetic",
          "evidence_status": "directly_observed",
          "recorded_at": "2026-03-07T14:25:00Z",
          "source_record_id": "synthetic-sleep-03"
        }
      },
      {
        "observation_id": "obs_sleep_04",
        "kind": "sleep_episode",
        "start_at": "2026-03-08T07:00:00Z",
        "end_at": "2026-03-08T14:55:00Z",
        "zone_id": "America/New_York",
        "sleep": {
          "classification": "principal"
        },
        "provenance": {
          "acquisition_method": "synthetic",
          "evidence_status": "directly_observed",
          "recorded_at": "2026-03-08T15:00:00Z",
          "source_record_id": "synthetic-sleep-04"
        }
      },
      {
        "observation_id": "obs_sleep_05",
        "kind": "sleep_episode",
        "start_at": "2026-03-09T07:50:00Z",
        "end_at": "2026-03-09T15:55:00Z",
        "zone_id": "America/New_York",
        "sleep": {
          "classification": "principal"
        },
        "provenance": {
          "acquisition_method": "synthetic",
          "evidence_status": "directly_observed",
          "recorded_at": "2026-03-09T16:00:00Z",
          "source_record_id": "synthetic-sleep-05"
        }
      },
      {
        "observation_id": "obs_sleep_06",
        "kind": "sleep_episode",
        "start_at": "2026-03-10T08:40:00Z",
        "end_at": "2026-03-10T16:40:00Z",
        "zone_id": "America/New_York",
        "sleep": {
          "classification": "principal"
        },
        "provenance": {
          "acquisition_method": "synthetic",
          "evidence_status": "directly_observed",
          "recorded_at": "2026-03-10T16:45:00Z",
          "source_record_id": "synthetic-sleep-06"
        }
      },
      {
        "observation_id": "obs_sleep_07",
        "kind": "sleep_episode",
        "start_at": "2026-03-11T09:30:00Z",
        "end_at": "2026-03-11T17:15:00Z",
        "zone_id": "America/New_York",
        "sleep": {
          "classification": "principal"
        },
        "provenance": {
          "acquisition_method": "synthetic",
          "evidence_status": "directly_observed",
          "recorded_at": "2026-03-11T17:20:00Z",
          "source_record_id": "synthetic-sleep-07"
        }
      },
      {
        "observation_id": "obs_sleep_08",
        "kind": "sleep_episode",
        "start_at": "2026-03-12T10:20:00Z",
        "end_at": "2026-03-12T18:35:00Z",
        "zone_id": "America/New_York",
        "sleep": {
          "classification": "principal"
        },
        "provenance": {
          "acquisition_method": "synthetic",
          "evidence_status": "directly_observed",
          "recorded_at": "2026-03-12T18:40:00Z",
          "source_record_id": "synthetic-sleep-08"
        }
      },
      {
        "observation_id": "obs_sleep_09",
        "kind": "sleep_episode",
        "start_at": "2026-03-13T11:10:00Z",
        "end_at": "2026-03-13T19:10:00Z",
        "zone_id": "America/New_York",
        "sleep": {
          "classification": "principal"
        },
        "provenance": {
          "acquisition_method": "synthetic",
          "evidence_status": "directly_observed",
          "recorded_at": "2026-03-13T19:15:00Z",
          "source_record_id": "synthetic-sleep-09"
        }
      },
      {
        "observation_id": "obs_sleep_10",
        "kind": "sleep_episode",
        "start_at": "2026-03-14T12:00:00Z",
        "end_at": "2026-03-14T19:55:00Z",
        "zone_id": "America/New_York",
        "sleep": {
          "classification": "principal"
        },
        "provenance": {
          "acquisition_method": "synthetic",
          "evidence_status": "directly_observed",
          "recorded_at": "2026-03-14T20:00:00Z",
          "source_record_id": "synthetic-sleep-10"
        }
      },
      {
        "observation_id": "obs_sleep_nap_01",
        "kind": "sleep_episode",
        "start_at": "2026-03-11T22:30:00Z",
        "end_at": "2026-03-11T23:15:00Z",
        "zone_id": "America/New_York",
        "sleep": {
          "classification": "nap"
        },
        "provenance": {
          "acquisition_method": "synthetic",
          "evidence_status": "directly_observed",
          "recorded_at": "2026-03-11T23:20:00Z",
          "source_record_id": "synthetic-nap-01"
        }
      },
      {
        "observation_id": "obs_activity_01",
        "kind": "activity_interval",
        "start_at": "2026-03-13T21:10:00Z",
        "end_at": "2026-03-13T21:40:00Z",
        "zone_id": "America/New_York",
        "activity": {
          "level": "active"
        },
        "provenance": {
          "acquisition_method": "synthetic",
          "evidence_status": "directly_observed",
          "recorded_at": "2026-03-13T21:45:00Z",
          "source_record_id": "synthetic-activity-01"
        }
      }
    ]
  },
  "correction_set": {
    "schema_version": "v1",
    "generated_at": "2026-03-15T00:00:00Z",
    "corrections": [
      {
        "correction_id": "cor_sleep_04_start",
        "target_observation_id": "obs_sleep_04",
        "created_at": "2026-03-08T08:25:00Z",
        "reason": "user_edit",
        "changes": {
          "start_at": "2026-03-08T07:10:00Z"
        }
      },
      {
        "correction_id": "cor_nap_excluded",
        "target_observation_id": "obs_sleep_nap_01",
        "created_at": "2026-03-12T08:00:00Z",
        "reason": "user_edit",
        "changes": {
          "excluded": true
        }
      }
    ]
  }
}
